<?xml version="1.0" encoding="UTF-8" ?>
<game xs:noNamespaceSchemaLocation="game.xsd"
	xmlns:xs="http://www.w3.org/2001/XMLSchema-instance">

	<armes>
		<arme name="Bouclier" tir="Bouclier" damage="20" recul="300"
			reload="3" />
		<arme name="Resistance" tir="Resistance" damage="20" recul="0"
			reload="300" />
		<arme name="Transistor" tir="Transistor" damage="40" recul="400"
			reload="50" />
	</armes>

	<botTypes>
		<botType name="bino" arme="Bouclier" comportement="ToucherBotBehaviour"
			life="1000" />
		<botType name="soso" arme="Resistance" comportement="FlyBotBehaviour"
			life="50" />
	</botTypes>

	<levels>
		<level src="level1.xml" />
		<level src="level2.xml" />
		<level src="level3.xml" />
	</levels>

</game>